{
  "$schema": "./language.schema.json",
  "tag": "en",
  "article": "an",
  "keyArticles": ["the", "a", "an"],
  "frontMatter": [
    "contents",
    "table of contents",
    "copyright",
    "title page",
    "half title",
    "half-title",
    "dedication",
    "epigraph",
    "cover",
    "praise for",
    "about the publisher",
    "imprint",
    "colophon",
    "frontispiece",
    "series page"
  ],
  "backMatter": [
    "about the author",
    "about the authors",
    "acknowledg*",
    "also by",
    "endnotes",
    "end notes",
    "notes",
    "glossary",
    "index",
    "bibliography",
    "credits",
    "newsletter",
    "sneak peek",
    "excerpt",
    "reading group",
    "discussion questions",
    "about the type",
    "licence",
    "license"
  ],
  "chapterWords": ["chapter", "part", "book", "volume"],
  "numberWords": {
    "one": 1,
    "two": 2,
    "three": 3,
    "four": 4,
    "five": 5,
    "six": 6,
    "seven": 7,
    "eight": 8,
    "nine": 9,
    "ten": 10,
    "eleven": 11,
    "twelve": 12,
    "thirteen": 13,
    "fourteen": 14,
    "fifteen": 15,
    "sixteen": 16,
    "seventeen": 17,
    "eighteen": 18,
    "nineteen": 19,
    "twenty": 20,
    "thirty": 30,
    "forty": 40,
    "fifty": 50,
    "sixty": 60,
    "seventy": 70,
    "eighty": 80,
    "ninety": 90
  },
  "ordinals": {
    "first": 1,
    "second": 2,
    "third": 3,
    "fourth": 4,
    "fifth": 5,
    "sixth": 6,
    "seventh": 7,
    "eighth": 8,
    "ninth": 9,
    "tenth": 10,
    "eleventh": 11,
    "twelfth": 12,
    "thirteenth": 13,
    "fourteenth": 14,
    "fifteenth": 15,
    "sixteenth": 16,
    "seventeenth": 17,
    "eighteenth": 18,
    "nineteenth": 19,
    "twentieth": 20
  },
  "commonWords": [
    "the",
    "and",
    "of",
    "to",
    "a",
    "in",
    "is",
    "it",
    "i",
    "that",
    "was",
    "he",
    "she",
    "for",
    "on",
    "with",
    "as",
    "his",
    "her",
    "at",
    "by",
    "this",
    "had",
    "not",
    "but",
    "from",
    "they",
    "you",
    "have",
    "were",
    "which",
    "there",
    "been",
    "would",
    "their",
    "said",
    "are",
    "be",
    "we",
    "my",
    "him",
    "what",
    "so",
    "if",
    "about",
    "who",
    "them",
    "then",
    "when",
    "could",
    "into",
    "no",
    "all",
    "do",
    "me",
    "go"
  ],
  "preambles": ["here is", "here's", "sure,", "sure!", "translation:", "translated text:"]
}
